{
  "$schema": "../schemas/finding.schema.json",
  "record_type": "finding",
  "finding_id": "FND-LOG-002",
  "name": "Log integrity protection not addressed",
  "description": "The log store offers no protection against alteration or deletion by the same access that could cause an incident, and the entity has not documented a position on whether that matters for its threat model.",
  "domain": "security_operations",
  "finding_category": "design_deficiency",
  "observation_class": "informational_observation",
  "conclusion_rules": {
    "may_assert": [
      "That no immutability, write-once, or separate-account protection is configured on the log store, where the configuration shows it.",
      "That administrators of the monitored systems also hold delete rights over the logs of those systems."
    ],
    "must_not_assert": [
      "That logs were altered. The observation concerns the possibility, not any occurrence.",
      "That log immutability is required by SOC 2. It is not named anywhere in the criteria."
    ],
    "escalates_to": [
      {
        "observation_class": "control_design_gap",
        "when": "The entity's own policy asserts log integrity protection that the configuration does not implement, making it a design claim the deployment does not support."
      }
    ]
  },
  "affected_criteria": [
    "CC7.2"
  ],
  "affected_controls": [
    "SOC2-CC7.2-001"
  ],
  "default_severity": "low",
  "severity_factors": {
    "criterion_impact": "Monitoring evidence could be altered by the access it is meant to observe, which limits what the record proves.",
    "pervasiveness": "Broad delete rights across all indices differ from a single administrator with retention management rights.",
    "compensating_controls": [
      "SOC2-CC6.3-002"
    ],
    "detectability": "Visible from log store access and retention configuration.",
    "escalates_when": [
      "Production administrators hold delete rights over production logs",
      "Policy claims protection the configuration does not provide"
    ],
    "de_escalates_when": [
      "Logs are forwarded to a separate account or tenant outside the monitored environment",
      "Retention is enforced by a platform lifecycle policy administrators cannot override"
    ]
  },
  "detection_signals": [
    {
      "signal_id": "SIG-001",
      "signal": "Log store configuration shows no immutability or write-once setting.",
      "source_of_signal": "evidence_analysis",
      "related_evidence": [
        "EV-LOG-001"
      ],
      "confidence": "medium"
    },
    {
      "signal_id": "SIG-002",
      "signal": "Principals with delete rights over the log store overlap with administrators of the monitored systems.",
      "source_of_signal": "evidence_analysis",
      "related_evidence": [
        "EV-LOG-001",
        "EV-ACCESS-003"
      ],
      "confidence": "medium"
    },
    {
      "signal_id": "SIG-003",
      "signal": "Logging policy asserts integrity protection the configuration does not implement.",
      "source_of_signal": "policy_analysis",
      "confidence": "high"
    }
  ],
  "auditor_impact": "Auditors rarely test log immutability directly for a SOC 2 examination, and its absence is not commonly reported. DriftGuard raises it as a risk signal rather than as a predicted exception.",
  "customer_impact": "Records of activity affecting the customer's data could be modified by the same access that affected it.",
  "remediations": [
    "REM-LOG-002"
  ],
  "false_positive_guidance": [
    "Classified informational by default because no criterion names log immutability. Never present it as a requirement.",
    "Not a gap where logs are forwarded to a separate account or tenant that monitored-system administrators cannot reach; that is the protection, achieved architecturally.",
    "Not a gap where platform lifecycle policy enforces retention and administrators cannot shorten it.",
    "Small entities often cannot separate these duties. Assess proportionately rather than applying a large-organization model."
  ],
  "sources": [
    "SRC-AICPA-TSC-2017-R2022",
    "SRC-DG-AUDITOR-PRACTICE"
  ],
  "source_refs": [
    {
      "source_id": "SRC-AICPA-TSC-2017-R2022",
      "locator": "TSC CC7.2",
      "authority_tier": 1,
      "supports": "The criteria potentially affected.",
      "verification_status": "verified"
    },
    {
      "source_id": "SRC-DG-AUDITOR-PRACTICE",
      "authority_tier": 4,
      "supports": "Typical auditor treatment, severity factors, and detection approach.",
      "verification_status": "interpretation"
    }
  ],
  "authority_tier_dominant": 4,
  "verification_status": "interpretation",
  "version": "0.1.0",
  "schema_version": "0.2.0",
  "status": "draft",
  "created": "2026-08-12",
  "last_reviewed": "2026-08-12",
  "notes": [
    "DriftGuard finding archetype. DriftGuard produces observations against it; only a service auditor issues findings."
  ]
}
